{
  "approved_effect_count": 1,
  "denied_effect_count": 0,
  "denied_authorization_rejected": true,
  "consumed_replay_effect_count": 0,
  "consumed_replay_rejected": true,
  "failed_effect_count": 1,
  "failed_replay_effect_count": 0,
  "failed_replay_rejected": true,
  "core_rpc_type": "go_internal_grpc_mtls",
  "core_rpc_authenticated": true,
  "schema_version": "dipole.agent.approval-gate-drill.v2",
  "outcome": "passed",
  "isolation": "disposable_go_core_mtls_approval_gate_fixture",
  "collected_at": "2026-09-04T12:46:35.089Z",
  "expires_at": "2026-09-05T12:46:35.089Z",
  "production_authority": false,
  "content_sha256": "9473e6ed3ead574c8c54d964dfca73adb4bdf2ba42c63fe765f95068b96057f0"
}
